<?xml version="1.0" encoding="UTF-8"?>
<catBase xmlns:xsi="http://www.w3.org/2001/XMLSchema-instance"
    xsi:noNamespaceSchemaLocation="cat.xsd">
    <about>
        <title>Cat Adoption Platform</title>
        <author fistName="Yufei" lastName="Li"/>
        <description>
            <p>Yufei is a second-year graduate student in the iSchool. She is specialized in <b>Data
                    Science</b> and <b>Business Intelligence</b>.</p>
            <br/>
            <p>In her spare time, she loves</p>
            <ul>
                <li>Swimming</li>
                <li>Playing with <i>cats</i></li>
            </ul>
            <br/>
        </description>
    </about>
    <breeds>
        <breed breedId="Breed">
            <name>Breeds</name>
            <breed breedId="Breed_0">
                <name>Domestic Cats</name>
                <breed breedId="Breed_01">
                    <name>Domestic Medium Hair/Mix</name>
                    <catRefId>CAT_40667429</catRefId>
                    <catRefId>CAT_40722176</catRefId>
                    <catRefId>CAT_40627497</catRefId>
                    <catRefId>CAT_40565883</catRefId>
                    <catRefId>CAT_40722239</catRefId>
                    <catRefId>CAT_40618814</catRefId>
                    <catRefId>CAT_40583096</catRefId>
                </breed>
                <breed breedId="Breed_02">
                    <name>Domestic Longhair/Mix</name>
                    <catRefId>CAT_40492066</catRefId>
                    <catRefId>CAT_40722192</catRefId>
                </breed>
                <breed breedId="Breed_03">
                    <name>Domestic Shorthair/Mix</name>
                    <catRefId>CAT_40722652</catRefId>
                    <catRefId>CAT_40683211</catRefId>
                    <catRefId>CAT_40693257</catRefId>
                    <catRefId>CAT_40598525</catRefId>
                    <catRefId>CAT_40722228</catRefId>
                    <catRefId>CAT_39360040</catRefId>
                </breed>
            </breed>
        </breed>

    </breeds>
    <alphabeticalIndex>
        <letter>
            <name>A-G</name>
            <catRefId>CAT_40667429</catRefId>
            <catRefId>CAT_40722176</catRefId>
            <catRefId>CAT_40492066</catRefId>
            <catRefId>CAT_40722652</catRefId>
            <catRefId>CAT_40627497</catRefId>
            <catRefId>CAT_40722192</catRefId>
            <catRefId>CAT_40683211</catRefId>
        </letter>
        <letter>
            <name>H-M</name>
            <catRefId>CAT_40693257</catRefId>
            <catRefId>CAT_40598525</catRefId>
            <catRefId>CAT_40722239</catRefId>
            <catRefId>CAT_40722228</catRefId>
            <catRefId>CAT_40565883</catRefId>
        </letter>
        <letter>
            <name>N-Z</name>
            <catRefId>CAT_39360040</catRefId>
            <catRefId>CAT_40618814</catRefId>
            <catRefId>CAT_40583096</catRefId>
        </letter>
    </alphabeticalIndex>
    <cats>
        <cat id="CAT_40667429" age="1 year 6 month 10 days">
            <name>Brooklynn</name>
            <description>
                <p><b>Brooklynn</b> is a gorgeous one and a half year old tuxedo ready to go home!
                    Brooklynn came to <pubMentioned>Homeward</pubMentioned>
                    <xref id="homeward" type="web" dest="https://www.homewardpet.org/events-new/">
                        <xrefText> (<hotText>https://www.homewardpet.org/events-new/</hotText>)
                        </xrefText>
                    </xref> after her family was no longer able to care for her. She has lived with
                    cats and dogs before and did well with both.</p>
                <p>It is:</p>
                <ul>
                    <li>soft</li>
                    <li>lovely</li>
                </ul>
                <p>Come meet <b>Brooklynn</b> today!</p>
                <p>Brooklynn will likely do well with <i>slightly older kids</i> that can handle her
                    gently and participate in her care. </p>
                <br/>
            </description>
            <specs>
                <breed>Domestic Medium Hair/Mix</breed>
                <gender>Female</gender>
                <spayed>true</spayed>
                <size>Medium</size>
                <color>Black/White</color>
                <declawed>false</declawed>
            </specs>
            <adoptionPrice>100 dollars</adoptionPrice>
            <location>Cat Room </location>
            <site>Homeward Pet Adoption Center</site>
            <images>
                <image fileName="CAT_40667429.jpg" caption="Brooklynn"/>
            </images>
            <relatedCats>
                <catRefId>CAT_40722652</catRefId>
                <catRefId>CAT_40722228</catRefId>
            </relatedCats>
            <source>
                <sourceRefId>Brooklynn</sourceRefId>
            </source>
        </cat>
        <cat id="CAT_40722176" age="6 months 4 days">
            <name>Bronco</name>
            <description>
                <p>Bronco is a sweet 6 month old adolescent that is ready romp around with his new
                    family! Bronco, like most other young cats, has plenty of energy, and would do
                    best in a home that will give him lots of playtime. We don't know if Bronco has
                    lived with other cats or dogs before, so introductions should be done slowly.
                    Bronco would likely do best with slightly older kids that understand how to
                    handle him gently.</p>
                <br/>
            </description>
            <specs>
                <breed>Domestic Medium Hair/Mix</breed>
                <gender>Male</gender>
                <spayed>true</spayed>
                <size>Medium</size>
                <color>Black/Smoke</color>
                <declawed>false</declawed>
            </specs>
            <adoptionPrice>100 dollars</adoptionPrice>
            <location>Cat Room </location>
            <site>Homeward Pet Adoption Center</site>
            <images>
                <image fileName="CAT_40722176.jpg" caption="Bronco"/>
            </images>
            <relatedCats>
                <catRefId>CAT_40693257</catRefId>
            </relatedCats>
            <source>
                <sourceRefId>Bronco</sourceRefId>
            </source>
        </cat>
        <cat id="CAT_40492066" age="5 years 1 month 7 days">
            <name>Bugsy</name>
            <description>
                <p>Bugsy is a Staff Pick! Meet Bugsy! This adorably fluffy orange tabby is looking
                    for the loving home he so deserves. Bugsy was rescued from a hoarding situation
                    and was in need of medical care when he arrived. Bugsy had an old injury to one
                    of his eyes, and that eye needed to be removed. He is now on the mend and
                    healing well, and will adjust to life with just one eye without any issues.
                    Bugsy is understandably feeling a little shy in the busy shelter, but don't pass
                    him by! He is a super sweet and gentle kitty, whose personality will start to
                    blossom once he feels safe. With love and patience, we think this guy could be
                    compatible with gentle older children that can give him space while he adjusts
                    to his new home. Bugsy is positive for feline immunodeficiency virus - an easy
                    illness to manage (though he should be the only cat in the home, or live with
                    other FIV positive cats). We are not sure if Bugsy has lived with dogs before,
                    so slow and gradual introductions are recommended. Come in and meet Bugsy
                    today!</p>
                <br/>
            </description>
            <specs>
                <breed>Domestic Longhair/Mix</breed>
                <gender>Male</gender>
                <spayed>true</spayed>
                <size>Medium</size>
                <color>Orange</color>
                <declawed>false</declawed>
            </specs>
            <adoptionPrice>75 dollars</adoptionPrice>
            <location> Cat Room </location>
            <site>Homeward Pet Adoption Center</site>
            <images>
                <image fileName="CAT_40492066.jpg" caption="Bugsy"/>
            </images>
            <relatedCats>
                <catRefId>CAT_40627497</catRefId>
                <catRefId>CAT_40683211</catRefId>
                <catRefId>CAT_40565883</catRefId>
                <catRefId>CAT_40618814</catRefId>
                <catRefId>CAT_40583096</catRefId>
            </relatedCats>
            <source>
                <sourceRefId>Bugsy</sourceRefId>
            </source>
        </cat>
        <cat id="CAT_40722652" age="2 months 11 days">
            <name>Cupid</name>
            <description>
                <p> Cupid is a playful kitten that is ready to find his forever home! He is a very
                    curious and active kitten that loves playing with feather toys and chasing
                    anything that makes a crinkling sound. He definitely needs another kitten buddy
                    at home! All kittens are active and playful and looking for homes that can
                    provide them with daily playtime and lots of interaction - it is important for
                    kittens to get handled regularly so they get used to being pet and touched. They
                    also need to be taught that hands are not toys and skin is not for biting. Due
                    to their social needs and energy levels, Homeward Pet advises that kittens be
                    adopted in pairs or into homes with another young cat. Kittens are fragile and
                    require careful handling, so we recommend that families with children under 5